{
  "schema_version": 1,
  "execution_mode": "SIMULATED",
  "experiment": "E2_STATEFUL_VS_SINGLE_CALL_V1",
  "seed_case_id": "ed227cc1f4f8155eab5f29a60a7c24573c7e360e5a2347cbedd43a426f61342b",
  "budget_per_trial": 512,
  "trials_per_mode": 20,
  "base_campaign_seed": 20260831,
  "single_call_maximum_sequence_length": 1,
  "stateful_maximum_sequence_length": 6,
  "provenance": {
    "recorded_at_utc": "2026-08-31T17:17:21.0000000\u002B00:00",
    "source_commit_time_utc": "2026-08-31T17:17:21.0000000\u002B00:00",
    "reproducible_timestamp_policy": "SOURCE_COMMIT_TIME",
    "git_commit": "55c31b25902157cddc9014bb9fdaa598bede40a2",
    "source_tree_digest": "bc0d06a2759e2429b0fec5683f3102e4644628f30b3fe6032a21a233d1333338",
    "source_tree_digest_algorithm": "GIT_TREE_SHA256_V1",
    "experiment_definition_digest": "543d6a94a8d0e4352e26d299f0ec151c1248ff86228ad74c0359dc67de377bb5",
    "case_schema_version": 1,
    "engine_version": "1.4.0-sim"
  },
  "trials": [
    {
      "trial": 1,
      "mode": "SINGLE_CALL",
      "maximum_sequence_length": 1,
      "campaign_seed": 20260831,
      "executions": 26,
      "found": false,
      "first_finding_execution": null,
      "coverage_count": 8,
      "corpus_count": 5,
      "raw_synthetic_failures": 0,
      "exact_signatures": 0
    },
    {
      "trial": 1,
      "mode": "STATEFUL",
      "maximum_sequence_length": 6,
      "campaign_seed": 20260831,
      "executions": 512,
      "found": true,
      "first_finding_execution": 113,
      "coverage_count": 99,
      "corpus_count": 325,
      "raw_synthetic_failures": 261,
      "exact_signatures": 1
    },
    {
      "trial": 2,
      "mode": "SINGLE_CALL",
      "maximum_sequence_length": 1,
      "campaign_seed": 20260832,
      "executions": 26,
      "found": false,
      "first_finding_execution": null,
      "coverage_count": 8,
      "corpus_count": 5,
      "raw_synthetic_failures": 0,
      "exact_signatures": 0
    },
    {
      "trial": 2,
      "mode": "STATEFUL",
      "maximum_sequence_length": 6,
      "campaign_seed": 20260832,
      "executions": 512,
      "found": false,
      "first_finding_execution": null,
      "coverage_count": 240,
      "corpus_count": 143,
      "raw_synthetic_failures": 0,
      "exact_signatures": 0
    },
    {
      "trial": 3,
      "mode": "SINGLE_CALL",
      "maximum_sequence_length": 1,
      "campaign_seed": 20260833,
      "executions": 26,
      "found": false,
      "first_finding_execution": null,
      "coverage_count": 8,
      "corpus_count": 5,
      "raw_synthetic_failures": 0,
      "exact_signatures": 0
    },
    {
      "trial": 3,
      "mode": "STATEFUL",
      "maximum_sequence_length": 6,
      "campaign_seed": 20260833,
      "executions": 512,
      "found": true,
      "first_finding_execution": 189,
      "coverage_count": 86,
      "corpus_count": 265,
      "raw_synthetic_failures": 231,
      "exact_signatures": 1
    },
    {
      "trial": 4,
      "mode": "SINGLE_CALL",
      "maximum_sequence_length": 1,
      "campaign_seed": 20260834,
      "executions": 26,
      "found": false,
      "first_finding_execution": null,
      "coverage_count": 8,
      "corpus_count": 5,
      "raw_synthetic_failures": 0,
      "exact_signatures": 0
    },
    {
      "trial": 4,
      "mode": "STATEFUL",
      "maximum_sequence_length": 6,
      "campaign_seed": 20260834,
      "executions": 512,
      "found": true,
      "first_finding_execution": 466,
      "coverage_count": 182,
      "corpus_count": 158,
      "raw_synthetic_failures": 22,
      "exact_signatures": 1
    },
    {
      "trial": 5,
      "mode": "SINGLE_CALL",
      "maximum_sequence_length": 1,
      "campaign_seed": 20260835,
      "executions": 26,
      "found": false,
      "first_finding_execution": null,
      "coverage_count": 8,
      "corpus_count": 5,
      "raw_synthetic_failures": 0,
      "exact_signatures": 0
    },
    {
      "trial": 5,
      "mode": "STATEFUL",
      "maximum_sequence_length": 6,
      "campaign_seed": 20260835,
      "executions": 512,
      "found": false,
      "first_finding_execution": null,
      "coverage_count": 210,
      "corpus_count": 165,
      "raw_synthetic_failures": 0,
      "exact_signatures": 0
    },
    {
      "trial": 6,
      "mode": "SINGLE_CALL",
      "maximum_sequence_length": 1,
      "campaign_seed": 20260836,
      "executions": 26,
      "found": false,
      "first_finding_execution": null,
      "coverage_count": 8,
      "corpus_count": 5,
      "raw_synthetic_failures": 0,
      "exact_signatures": 0
    },
    {
      "trial": 6,
      "mode": "STATEFUL",
      "maximum_sequence_length": 6,
      "campaign_seed": 20260836,
      "executions": 512,
      "found": false,
      "first_finding_execution": null,
      "coverage_count": 218,
      "corpus_count": 169,
      "raw_synthetic_failures": 0,
      "exact_signatures": 0
    },
    {
      "trial": 7,
      "mode": "SINGLE_CALL",
      "maximum_sequence_length": 1,
      "campaign_seed": 20260837,
      "executions": 26,
      "found": false,
      "first_finding_execution": null,
      "coverage_count": 8,
      "corpus_count": 5,
      "raw_synthetic_failures": 0,
      "exact_signatures": 0
    },
    {
      "trial": 7,
      "mode": "STATEFUL",
      "maximum_sequence_length": 6,
      "campaign_seed": 20260837,
      "executions": 512,
      "found": true,
      "first_finding_execution": 58,
      "coverage_count": 87,
      "corpus_count": 339,
      "raw_synthetic_failures": 295,
      "exact_signatures": 1
    },
    {
      "trial": 8,
      "mode": "SINGLE_CALL",
      "maximum_sequence_length": 1,
      "campaign_seed": 20260838,
      "executions": 26,
      "found": false,
      "first_finding_execution": null,
      "coverage_count": 8,
      "corpus_count": 5,
      "raw_synthetic_failures": 0,
      "exact_signatures": 0
    },
    {
      "trial": 8,
      "mode": "STATEFUL",
      "maximum_sequence_length": 6,
      "campaign_seed": 20260838,
      "executions": 512,
      "found": true,
      "first_finding_execution": 177,
      "coverage_count": 124,
      "corpus_count": 293,
      "raw_synthetic_failures": 214,
      "exact_signatures": 1
    },
    {
      "trial": 9,
      "mode": "SINGLE_CALL",
      "maximum_sequence_length": 1,
      "campaign_seed": 20260839,
      "executions": 26,
      "found": false,
      "first_finding_execution": null,
      "coverage_count": 8,
      "corpus_count": 5,
      "raw_synthetic_failures": 0,
      "exact_signatures": 0
    },
    {
      "trial": 9,
      "mode": "STATEFUL",
      "maximum_sequence_length": 6,
      "campaign_seed": 20260839,
      "executions": 512,
      "found": true,
      "first_finding_execution": 327,
      "coverage_count": 189,
      "corpus_count": 267,
      "raw_synthetic_failures": 132,
      "exact_signatures": 1
    },
    {
      "trial": 10,
      "mode": "SINGLE_CALL",
      "maximum_sequence_length": 1,
      "campaign_seed": 20260840,
      "executions": 26,
      "found": false,
      "first_finding_execution": null,
      "coverage_count": 8,
      "corpus_count": 5,
      "raw_synthetic_failures": 0,
      "exact_signatures": 0
    },
    {
      "trial": 10,
      "mode": "STATEFUL",
      "maximum_sequence_length": 6,
      "campaign_seed": 20260840,
      "executions": 512,
      "found": true,
      "first_finding_execution": 270,
      "coverage_count": 78,
      "corpus_count": 227,
      "raw_synthetic_failures": 183,
      "exact_signatures": 1
    },
    {
      "trial": 11,
      "mode": "SINGLE_CALL",
      "maximum_sequence_length": 1,
      "campaign_seed": 20260841,
      "executions": 26,
      "found": false,
      "first_finding_execution": null,
      "coverage_count": 8,
      "corpus_count": 5,
      "raw_synthetic_failures": 0,
      "exact_signatures": 0
    },
    {
      "trial": 11,
      "mode": "STATEFUL",
      "maximum_sequence_length": 6,
      "campaign_seed": 20260841,
      "executions": 512,
      "found": true,
      "first_finding_execution": 333,
      "coverage_count": 200,
      "corpus_count": 239,
      "raw_synthetic_failures": 123,
      "exact_signatures": 1
    },
    {
      "trial": 12,
      "mode": "SINGLE_CALL",
      "maximum_sequence_length": 1,
      "campaign_seed": 20260842,
      "executions": 26,
      "found": false,
      "first_finding_execution": null,
      "coverage_count": 8,
      "corpus_count": 5,
      "raw_synthetic_failures": 0,
      "exact_signatures": 0
    },
    {
      "trial": 12,
      "mode": "STATEFUL",
      "maximum_sequence_length": 6,
      "campaign_seed": 20260842,
      "executions": 512,
      "found": true,
      "first_finding_execution": 148,
      "coverage_count": 128,
      "corpus_count": 324,
      "raw_synthetic_failures": 249,
      "exact_signatures": 1
    },
    {
      "trial": 13,
      "mode": "SINGLE_CALL",
      "maximum_sequence_length": 1,
      "campaign_seed": 20260843,
      "executions": 26,
      "found": false,
      "first_finding_execution": null,
      "coverage_count": 8,
      "corpus_count": 5,
      "raw_synthetic_failures": 0,
      "exact_signatures": 0
    },
    {
      "trial": 13,
      "mode": "STATEFUL",
      "maximum_sequence_length": 6,
      "campaign_seed": 20260843,
      "executions": 512,
      "found": false,
      "first_finding_execution": null,
      "coverage_count": 210,
      "corpus_count": 162,
      "raw_synthetic_failures": 0,
      "exact_signatures": 0
    },
    {
      "trial": 14,
      "mode": "SINGLE_CALL",
      "maximum_sequence_length": 1,
      "campaign_seed": 20260844,
      "executions": 26,
      "found": false,
      "first_finding_execution": null,
      "coverage_count": 8,
      "corpus_count": 5,
      "raw_synthetic_failures": 0,
      "exact_signatures": 0
    },
    {
      "trial": 14,
      "mode": "STATEFUL",
      "maximum_sequence_length": 6,